{
  "schema_version": "8dionysus_codex_plane_regeneration_report_v1",
  "regeneration_report_id": "cpregen-2026-04-11T210500Z-root-srv",
  "source_profile_ref": "8Dionysus:config/codex_plane/profiles/linux-python3.json",
  "target_workspace_root": "/srv/AbyssOS",
  "render_posture": "execute",
  "rendered_files": [
    {
      "relative_path": ".codex/config.toml",
      "source_path": "8Dionysus:config/codex_plane/runtime_manifest.v1.json",
      "mode": "rewrite",
      "changed": true,
      "sha256": "aaaaaaaaaaaaaaaaaaaaaaaaaaaaaaaaaaaaaaaaaaaaaaaaaaaaaaaaaaaaaaaa"
    },
    {
      "relative_path": ".codex/hooks.json",
      "source_path": "8Dionysus:config/codex_plane/runtime_manifest.v1.json",
      "mode": "rewrite",
      "changed": true,
      "sha256": "bbbbbbbbbbbbbbbbbbbbbbbbbbbbbbbbbbbbbbbbbbbbbbbbbbbbbbbbbbbbbbbb"
    }
  ],
  "stable_names": {
    "aoa_workspace": true,
    "aoa_stats": true,
    "aoa_memo": true,
    "aoa_session_memory": true,
    "aoa_evals": true,
    "aoa_decisions": true,
    "abyss_machine": true
  },
  "warnings": [],
  "generated_at": "2026-04-11T21:05:00Z"
}
